{
  "synthetic": true,
  "ticket_id": "SYN-1042",
  "channel": "portal",
  "as_of": "2026-10-29",
  "requester": {
    "staff_id": "SYN-STAFF-014",
    "signed_in": true
  },
  "subject_account": {
    "staff_id": "SYN-STAFF-014"
  },
  "identity_check": {
    "method": "entra_session",
    "result": "passed",
    "checked_by": "channel",
    "as_of": "2026-10-29"
  },
  "device": {
    "asset_tag": "SYN-LAP-220",
    "change_requested": false
  },
  "summary": "VPN client shows error 809 on the office laptop.",
  "diagnostics": {
    "os": "Windows 11",
    "error_code": "809",
    "network_connected": true,
    "free_text": ""
  }
}
